topic_id,bias_id,topic,title,source,bias,desc.
1,4,Abortion- Lean Right,When Is a Constitutional Right Not a Right?,Wall Street Journal (Opinion), Lean Right,"If you want to carry a firearm in New York state, you need to convince a local official that you have “proper cause.” That’s easy in some counties but almost..."
1,4,Abortion- Lean Right,Why Didn't COVID-19 Kill the Constitution?,Reason, Lean Right,"We can thank judges who were prepared to enforce constitutional limits on public health powers.

The day after the nation's first COVID-19 lockdown took..."
1,4,Abortion- Lean Right,Top Trump allies begin legal effort to stop federal government from trampling on constitutional rights,Washington Examiner, Lean Right,"Allies of former President Donald Trump are launching a legal team whose mission is to stop ""big tech, big media and big government"" from trampling on the..."
1,5,Abortion- Right,Policing Speech,City Journal, Right,"Amid a staggering wave of gun violence in New York City, with shootings this year measuring 42 percent higher than the same period in 2020, Mayor Bill de..."
1,5,Abortion- Right,Schiff's Defense of Impeachment Comes From....British History,Townhall, Right,"Lawyers for former President Trump will challenge the constitutionality of impeaching a private citizen in the trial that is set to begin Tuesday.

“The..."
2,5,Bridging Divides- Right,"Joe Biden breaks 'ambitious' campaign promise to address student loans, proposal missing from budget",TheBlaze.com, Right,"President Joe Biden is breaking one of his central campaign promises, surely upsetting progressives who wanted Biden to unilaterally cancel the massive bill of..."
2,5,Bridging Divides- Right,"‘People Are Going To Be Very, Very Happy When I Make A Certain Announcement!’ Donald Trump Hints At 2024 Run",The Daily Wire, Right,One question at the forefront of the minds of supporters and critics alike of former President Donald Trump is whether he will return to the campaign trail and...
2,4,Bridging Divides- Lean Right,When Wokeness Becomes Weakness,Ross Douthat, Lean Right,"Recently, James Carville, the unfrozen Clintonite of Democratic politics, stirred a predictable controversy by complaining about “wokeness” in an interview..."
2,4,Bridging Divides- Lean Right,"Rubio: Biden's Rhetoric, 1st-Day Policies Created Border Crisis",Newsmax (News), Lean Right,"President Joe Biden's rhetoric both before and after he took office, as well as his first-day policies after he was sworn in, are what is driving the current..."
2,5,Bridging Divides- Right,"Trump Tears Into Wall Street Journal, Georgia Republicans And Mitch McConnell In Lengthy Statement",The Daily Caller, Right,Former President Donald Trump blasted a Monday column from the Wall Street Journal Editorial Board in a lengthy statement distributed by his Save America PAC...
3,4,Campaign Finance- Lean Right,"Kamala Harris sidelined amid growing tensions with Biden, insiders say",New York Post (News), Lean Right,Vice President Kamala Harris feels increasingly isolated inside the White House as her approval ratings plummet — with...
3,5,Campaign Finance- Right,"Nearly half of voters say Biden worse president than expected, most don't want to see him run again: poll",Fox News (Online News), Right,"With exactly one year until the midterm elections, President Biden, Vice President Harris and Democrats in Congress face bleak ratings..."
3,5,Campaign Finance- Right,White House Announces Plan To Open Up Union Options To Federal Employees,One America News Network (OAN), Right,"As strikes sweep across the U.S., Kamala Harris is encouraging more federal employees to join unions. She elaborated on the policies in a Labor Task Force..."
3,5,Campaign Finance- Right,Harris Holds Double Standard On Abortions And Vaccinations,One America News Network (OAN), Right,"Kamala Harris delivered remarks on personal rights on abortions during a women’s reproductive rights roundtable, but failed to link the point to the issue of..."
3,4,Campaign Finance- Lean Right,"George W. Bush, Kamala Harris point to unity after 9/11 in memorial speeches",New York Post (News), Lean Right,"The chimes of the Bells of Remembrance at the memorial service for the victims and heroes of Flight 93 in Shanksville, PA, was followed Saturday by a..."
4,4,Coronavirus- Lean Right,Lines of cars wait to enter US as pandemic travel ban is lifted,New York Post (News), Lean Right,The US reopened its borders Monday after 20 months of travel restrictions — immediately creating wild miles-long lines of cars waiting to cross over from...
4,5,Coronavirus- Right,Border Arrests Hit All-Time High,National Review, Right,U.S. authorities detained more than 1.7 million illegal immigrants at the southern border during the 2021 fiscal year that ended in September as arrests by...
4,5,Coronavirus- Right,Biden Admin Will Reinstate Tump’s Remain In Mexico Policy In November,The Daily Caller, Right,"The Biden administration is planning to reinstate former President Donald Trump’s “Remain in Mexico” policy in November, CBS News reported on Friday.

A..."
4,5,Coronavirus- Right,US to reopen land borders next month for fully vaccinated,Fox News (Online News), Right,"After a 19-month freeze due to the COVID-19 pandemic, the U.S. is set to announce that it will reopen land borders with Canada and ..."
4,5,Coronavirus- Right,REPORT: Biden Might Keep ‘More Humane’ Version Of Trump Immigration Policy,The Daily Caller, Right,"President Joe Biden is reportedly considering revamping former President Donald Trump’s “Remain in Mexico” policy into “a more humane version,” multiple people..."
5,4,Criminal Justice- Lean Right,"Italy Mandates All Workers to Show COVID-19 ‘Green Pass,’ Prompting Protests",The Epoch Times, Lean Right,"The Italian government imposed one of the world’s strictest COVID-19 measures on Friday, requiring all workers in Italy to show a COVID-19..."
5,5,Criminal Justice- Right,UK Government Approves Coronavirus Vaccines for 12 to 15 Year Olds to ‘Reduce Disruption’ in Schools,Breitbart News, Right,The UK’s chief medical officer announced on Monday that children from the ages of 12 to 15 years old will be offered coronavirus vaccines in England....
5,5,Criminal Justice- Right,Thousands of anti-vaccine pass protestors take to streets of Paris - hours after neighbouring Italy starts demanding digital certificate to enter gyms and restaurants,Daily Mail, Right,Protesters took to the streets across France on Saturday for the fourth weekend in a row to rally against a new health pass needed to enter a cafe or...
5,5,Criminal Justice- Right,Death toll from Europe floods tops 150 as water recedes,Breitbart News, Right,The death toll from disastrous flooding in Western Europe rose above 150 on Saturday as rescue workers toiled to clear up the devastation revealed by receding...
5,5,Criminal Justice- Right,He Was Murdered Over a Lie: What the Killing of Samuel Paty Means for Free Expression,The Daily Signal, Right,"Samuel Paty was decapitated on Oct. 16, 2020, outside the middle school in a north Paris suburb where he had taught history and civics for five years. The..."
6,4,Education- Lean Right,"Vaccine Mandate Threatens Major Trucking Disruption, Industry Insiders Say",The Epoch Times, Lean Right,American truckers don’t like taking orders. But the Biden administration has increased pressure on some of them to take the vaccine—willing or unwilling....
6,4,Education- Lean Right,White House Orders Temporary Lift in Cargo Weight Capacity for Trucks,The Epoch Times, Lean Right,"President Joe Biden plans to sign an executive order to temporarily lift weight limits so trucks can carry more cargo, White House Press Secretary..."
6,4,Education- Lean Right,"UPS, FedEx, Walmart commit to 24/7 hours to alleviate LA port crunch",New York Post (News), Lean Right,"The White House says the Port of Los Angeles, UPS, FedEx and Walmart will commit to 24/7 work hours to alleviate a supply-chain crunch that threatens to leave..."
6,4,Education- Lean Right,"UPS, FedEx, Walmart commit to 24/7 hours to alleviate LA port crunch",New York Post (News), Lean Right,"The White House says the Port of Los Angeles, UPS, FedEx and Walmart will commit to 24/7 work hours to alleviate a supply-chain crunch that threatens to leave..."
6,5,Education- Right,"Biden to Address Supply Chain Logjam: Expanded Port Hours, Extra Shifts for Longshoremen",CNSNews.com, Right,"As supply chain disruptions make national headlines, leaving American businesses with fewer imported products to sell, President Biden today will meet with..."
7,5,Elections- Right,"In ‘Deep Blue’ New York, Voters Reject Democrats’ Push for Election Changes",The Daily Signal, Right,"In one of the bluest states in the nation, voters soundly rejected proposed changes to election law that congressional Democrats are trying to impose..."
7,4,Elections- Lean Right,Voters Are Done With COVID-19 and Pandemic-Powered Officials,Reason, Lean Right,"Politicians have been on a high over the last year-plus, wielding extraordinary power with the approval of voters fearful of viral infection. Democrats, in..."
7,5,Elections- Right,Justice Department sues Texas over election integrity legislation,Fox News (Online News), Right,"The Department of Justice announced Thursday that it filed a lawsuit against Texas, targeting a state law that proponents say aims to make..."
7,4,Elections- Lean Right,Senate GOP blocks federal election law debate for fourth time this year,New York Post (News), Lean Right,"Senate Democrats tried and failed once again Wednesday to begin debate on a bill that would radically revamp America’s election laws, as all but two..."
7,5,Elections- Right,"‘Our Broken Elections’: Who Broke Them and Why, and How to Fix Them",The Daily Signal, Right,"Election integrity is a fundamental requirement of a functioning democratic republic.

In the freest nation in the world, our system of government and our..."
8,5,Environment- Right,Joe Biden ‘Got a Handle on COVID’,Washington Free Beacon, Right,"CLAIM:

""Biden got a handle on COVID.""

— David Corn, D.C. bureau chief of Mother Jones

The lib reporter made the assertion on Twitter in..."
8,5,Environment- Right,Democrat Cindy Axne Falsely Claims Biden’s $1.75T Agenda Will Cost Iowans ‘Literally Nothing’,Breitbart Fact Check, Right,"CLAIM: Democrat Rep. Cindy Axne (D-IA) claimed last week that President Joe Biden’s Build Back Better agenda will cost Iowans “literally nothing.”

VERDICT:..."
8,5,Environment- Right,For Whom Do the Covid “Fact Checkers” Really Work?,Brownstone Institute, Right,"There are two types of COVID19 survivors— those who have documented recovery from sars-cov-2 (either PCR, antigen or serology + tests) or those who have self-..."
8,4,Environment- Lean Right,Beware People Trying to Dismiss Jack Dorsey's Inflation Analysis as Disinformation,Reason, Lean Right,"I hope you squirreled away that cool 16 cents you saved on your Fourth of July barbeque this year. Across the board, prices seem to be going up..."
8,4,Environment- Lean Right,Journalist Butchery of School Board Protests Upending Politics in Virginia and Elsewhere,Reason, Lean Right,The media pile-on atop Sen. Ted Cruz (R–Texas) for his comments Wednesday characterizing mock Nazi salutes at school board meetings as First...
9,5,Facts and Fact Checking- Right,Joe Biden Has Been Derelict In His Duty. He Is Unfit To Lead. He Should Be Impeached,The Federalist, Right,"The deadly attacks in Afghanistan should be the final straw for Biden, whose incompetence has now cost the lives of at least a dozen American soldiers.

Joe..."
9,4,Facts and Fact Checking- Lean Right,Marjorie Taylor Greene Says She'll Submit Impeachment Documents Against Biden,Newsmax (News), Lean Right,"Rep. Marjorie Taylor Greene says she will submit articles of impeachment against President Joe Biden on Friday.

The Georgia Republican's announcement..."
9,5,Facts and Fact Checking- Right,4 Factors to Watch in Cuomo Impeachment Probe,The Daily Signal, Right,"The Democrat-controlled New York State Assembly appears poised to move forward with impeachment proceedings against Gov. Andrew Cuomo, a fellow Democrat, after..."
9,4,Facts and Fact Checking- Lean Right,Trump launches Republican civil war with attack on 'hack' McConnell,Washington Examiner, Lean Right,Former President Donald Trump threatened an all-out civil war inside the Republican Party as he blamed Senate Minority Leader Mitch McConnell for election...
9,4,Facts and Fact Checking- Lean Right,Impeachment Based on Political Differences Becoming the Norm: Lindsey Graham,The Epoch Times, Lean Right,"Sen. Lindsey Graham (R-S.C.), the ranking member on the Senate Judiciary Committee, said that impeachments based on partisan differences appear to be becoming..."
10,4,Free Speech- Lean Right,Social Security payments to jump most in 39 years as inflation surges,Fox Business, Lean Right,"Millions of retirees and other Americans receiving Social Security benefits in 2022 are set to receive the biggest payment increase in four decades,..."
10,5,Free Speech- Right,"Biden fires Social Security Commissioner Andrew Saul, who says he isn't leaving",Fox News (Online News), Right,President Biden fired Social Security Commissioner Andrew Saul on Friday amid an ongoing dispute over his leadership of the independent agency...
10,4,Free Speech- Lean Right,"Coronavirus etiquette: Your guide to work, friends, food shopping and more",New York Post (News), Lean Right,"New Yorkers aren’t known for their politeness at the best of times. And Miss Manners definitely never prepped this city for a pandemic.

During lockdown,..."
10,4,Free Speech- Lean Right,Proposed Social Security disability changes could cut off disabled recipients,Pittsburgh Post-Gazette, Lean Right,"A proposed change to federal disability assistance would result in millions of more case reviews, likely cutting off many disabled recipients, if the changes..."
10,5,Free Speech- Right,The Red-Flag Warning on Your Social Security Statement,National Review, Right,"Sadly, America’s forthcoming “economic tsunami” is so predictable that our government issues an annual warning forecasting the year when — absent real reform..."
11,4,Gun Control and Gun Rights- Lean Right,Taxonomy Of Woke Religion,The American Conservative, Lean Right,Here’s a Shellenberger essay explaining why wokeism is a religion. He begins by pointing out how the devoutly woke believe things that are demonstrably...
11,5,Gun Control and Gun Rights- Right,How Getting Fired For His Beliefs Became A Huge Opportunity For My Husband And Our Family Canceling,The Federalist, Right,Canceling conservatives is not silencing or cowing them. It is driving Christians to consider the connections between their faith and their money and jobs...
11,5,Gun Control and Gun Rights- Right,Biden’s Visit to the Vatican,The American Spectator, Right,"In the days of John F. Kennedy, the Democrats emphasized their political distance from the pope. Kennedy promised Americans that he would never let the pope..."
11,4,Gun Control and Gun Rights- Lean Right,"Biden gives bizarre answer on abortion after meeting with pope, says Francis 'happy' he's a 'good Catholic'",Washington Examiner, Lean Right,President Joe Biden delivered a perplexing answer Friday about whether he and Pope Francis discussed abortion during their 90-minute meeting at the...
11,4,Gun Control and Gun Rights- Lean Right,Vatican Cardinal Mueller Calls for Exemptions on Vaccines,Newsmax (News), Lean Right,"Christians should be allowed to follow their conscience and opt out of vaccine mandates, especially in cases where aborted fetal tissue may have been part of..."
12,5,Healthcare- Right,Free-Speech Entrepreneurs,City Journal, Right,"When video-sharing platform Rumble announced in August that it had struck deals with such prominent figures as Glenn Greenwald and Tulsi Gabbard, it marked a..."
12,5,Healthcare- Right,"The Revolutionary Power of ‘Let’s Go, Brandon!’",Breitbart News, Right,"For very good reason, the media and Democrats feel threatened and terrified by the “Let’s go, Brandon!” chant, which is why we must never stop saying it.

If..."
12,4,Healthcare- Lean Right,Journalist Butchery of School Board Protests Upending Politics in Virginia and Elsewhere,Reason, Lean Right,The media pile-on atop Sen. Ted Cruz (R–Texas) for his comments Wednesday characterizing mock Nazi salutes at school board meetings as First...
12,5,Healthcare- Right,Minnesota Surgeon Fired After Speaking Out At School Board Meeting Against Mask Mandates,The Daily Caller, Right,A Minnesota surgeon was terminated after speaking at a public school board meeting where he called for the district to allow parents to decide whether their...
12,5,Healthcare- Right,Anarchy Reigns in Portland,The Daily Signal, Right,"Immediately upon taking office, President Joe Biden removed President Donald Trump’s designation of Portland, Oregon, as a jurisdiction in..."
13,4,Immigration- Lean Right,CDC: No Record of Naturally Immune Transmitting COVID-19,The Epoch Times, Lean Right,The Centers for Disease Control and Prevention (CDC) says that it has no record of people who are naturally immune transmitting the virus that causes COVID-19...
13,5,Immigration- Right,Pfizer Announces Deal To Provide COVID Pill To Low-Income Countries,The Daily Wire, Right,"In an agreement announced on Tuesday, Pfizer will permit its COVID-19 pill treatment to be manufactured and sold in countries that might not be able to..."
13,5,Immigration- Right,How COVID Lockdowns Handed Global Warming Extremists The Tools To Crush Freedom,The Federalist, Right,"We’ve rolled out the blueprint for a society that is nominally free, but willing to throw freedom away in a crisis.

The Glasgow Climate Conference wrapped..."
13,4,Immigration- Lean Right,Why COVID-19 is spiking in highly vaccinated states,Deseret News, Lean Right,"The coronavirus pandemic is still going. And as we head into the winter months, there are a number of questions about what might happen in states..."
13,4,Immigration- Lean Right,Jobs vs. jabs: Federal court upholds stay on Biden’s ‘sledgehammer’ vaccine mandate,Deseret News, Lean Right,"A federal appeals court late Friday upheld its stay of the Biden administration’s vaccine mandate for larger businesses, saying it leaves workers with a choice..."
14,5,Inequality- Right,Republican-Backed Bill Would Decriminalize Marijuana,The Daily Caller, Right,"South Carolina Republican Rep. Nancy Mace introduced a bill Monday that would decriminalize marijuana nationwide.

The bill, titled the States Reform Act,..."
14,4,Inequality- Lean Right,"Marijuana Arrests Plunged Last Year, Reflecting the Impact of Legalization",Reason, Lean Right,"Last year, according to data the FBI published this week, police in the United States made about 350,000 arrests for marijuana offenses, the lowest..."
14,4,Inequality- Lean Right,Chuck Schumer Says He Wants To Legalize Marijuana. His Bill Suggests Otherwise.,Reason, Lean Right,Senate Majority Leader Chuck Schumer (D–N.Y.) reportedly has been working for months to generate bipartisan support in his chamber for repealing the...
14,5,Inequality- Right,AOC says Olympic ban on marijuana is 'instrument' of racism following Black track star's suspension,Fox News (Online News), Right,"New York Democrat Rep. Alexandria Ocasio-Cortez claimed Friday the rule barring marijuana use during the Olympic races was an ""instrument..."
14,5,Inequality- Right,"Amazon Announces End To Marijuana Testing, Vows To ‘Actively’ Push For Federal Legalization, Expunging Criminal Records",The Daily Wire, Right,"On Tuesday, Amazon announced that they would be updating their drug testing policy, and will no longer be including marijuana as part of their drug screening..."
15,5,LGBT Rights- Right,How COVID Lockdowns Handed Global Warming Extremists The Tools To Crush Freedom,The Federalist, Right,"We’ve rolled out the blueprint for a society that is nominally free, but willing to throw freedom away in a crisis.

The Glasgow Climate Conference wrapped..."
15,5,LGBT Rights- Right,"World Leaders Reach Climate Deal At COP26, US And China Agree To Collaborate",The Daily Caller, Right,"World leaders have reached a deal at the United Nations Climate Change Conference (COP26) in Glasgow, Scotland to help combat the effects of climate change..."
15,4,LGBT Rights- Lean Right,Biden's environmentalism is pummeling the nation,Washington Examiner, Lean Right,"President Joe Biden inherited a great gift from the Trump administration: energy independence.

The benefits cannot be overstated: Cheap, reliable energy is..."
15,4,LGBT Rights- Lean Right,Biden admits US emissions were lowered during Trump years despite pulling out of Paris Accords,The Post Millennial, Lean Right,"As President Joe Biden restated his administration's commitment to the Paris Climate Accords, he had to admit that even after President Trump pulled the US..."
15,5,LGBT Rights- Right,Biden Moves to Wreck U.S. Oil Industry,National Review, Right,"the Biden administration is escalating its war against the American oil industry.

According to an article in the November 2, 2021, Wall Street..."
16,5,Media Bias- Right,Rep. Jim Jordan: Email Shows FBI Using ‘Counterterrorism Tools’ Against ‘Concerned Parents’,The Daily Signal, Right,"The top Republican on the House Judiciary Committee is asking Attorney General Merrick Garland about his October testimony to that same committee,..."
16,4,Media Bias- Lean Right,Texas Gov. Abbott Calls for Probe Into 'Availability of Pornography' in Schools,Newsmax (News), Lean Right,"Gov. Greg Abbott, R-Texas, has called for an investigation into criminal activity due to the availability of pornographic content in the state’s public schools..."
16,4,Media Bias- Lean Right,"Critical race theory pervasive in Virginia teacher training materials, contrary to Democratic claims",Washington Examiner, Lean Right,"Teacher training materials in Virginia provide instructions for incorporating critical race theory into the classroom, and the state's education department..."
16,4,Media Bias- Lean Right,"Eric Adams says he wants to end NYC’s school mask mandate, calls himself ‘conservative’ on crime",New York Post (News), Lean Right,Mayor-elect Eric Adams took to the airwaves Sunday and declared he wants to nix mask mandates in the classroom and called himself “conservative” on public...
16,5,Media Bias- Right,Virginia Upset Brewing? McAuliffe Missteps Give Youngkin an Opening in Election Day’s Marquee Race,National Review, Right,All eyes are on Virginia this election day as a last-minute surge in the polls for Republican gubernatorial candidate Glenn Youngkin has his party...
17,4,Middle East- Lean Right,Retail sales accelerate as supply chain crisis causes earlier start to holiday shopping season,Fox Business, Lean Right,Consumer spending accelerated in October as shoppers kicked off the holiday shopping season earlier than usual due to the supply chain bottlenecks. ...
17,5,Middle East- Right,"On Veterans Day, honor those who served and focus on what unites us",Fox News (Opinion), Right,"As we salute all American veterans on this special day, we must not forget that freedom is not free. Veterans Day is a day to honor and respect..."
17,4,Middle East- Lean Right,Can Halloween survive the war on holidays?,Deseret News, Lean Right,"First came the war on Christmas, then the war on Columbus Day. Could Halloween be next?

It’s already happening in some school districts, where..."
17,4,Middle East- Lean Right,White House Orders Temporary Lift in Cargo Weight Capacity for Trucks,The Epoch Times, Lean Right,"President Joe Biden plans to sign an executive order to temporarily lift weight limits so trucks can carry more cargo, White House Press Secretary..."
17,4,Middle East- Lean Right,CDC releases COVID travel guidance for holiday season,New York Post (News), Lean Right,"The unvaccinated are on the CDC’s holiday travel naughty list.

The Centers for Disease Control and Prevention released new guidance ahead of the..."
18,5,Polarization- Right,"I Interviewed Trump For 5 Hours. Here’s What He Told Me About ‘Stupid F—er’ McConnell, McCarthy’s Bromance With Luntz, And The Fake News That Bothered Him The Most",The Federalist, Right,"“I don’t like her … and I don’t like me.”

Former President Donald Trump was looking at a photo of the two of us that his assistant had just taken on my..."
18,5,Polarization- Right,Viral video accuses police officer of 'planting evidence.' Then police chief fires back with bodycam footage.,TheBlaze.com, Right,Activists on social media sent alleged a viral video showed a Wisconsin police officer planting evidence inside a vehicle during a traffic stop last Wednesday...
18,5,Polarization- Right,Democrats’ Definition Of ‘Misinformation’ Is Whatever Hurts Them Politically Today,The Federalist, Right,"Facebook is killing people, misinformation is rampant, and the only people who can save us from ourselves are the all-wise executives at 1600 Pennsylvania..."
18,4,Polarization- Lean Right,The Government Should Stop Telling Facebook To Suppress COVID-19 'Misinformation',Reason, Lean Right,"The federal government is stepping up its effort to purge the internet of COVID-19 ""misinformation."" On Thursday, White House Press Secretary Jen Psaki singled..."
18,4,Polarization- Lean Right,Experts Warn Accurate News Articles Are Misinformation if They Support Conservative Views,Reason, Lean Right,"Political bias is not new to journalism, either in the United States or anywhere else in the world. But check out how NPR discusses the conservative..."
