topic_id,bias_id,topic,title,source,bias,desc.
93,5,Middle East- Right,North Korea Accuses South Korea of Intrusion to Find Body of Killed Official,Breitbart News, Right,North Korea accused South Korea on Sunday of intruding into its territorial water with rescue ships seeking the body of an official recently killed by North...
93,4,Middle East- Lean Right,Sarah Huckabee Sanders says Trump told her ‘take one for the team’ after Kim Jong Un winked at her,New York Post (News), Lean Right,President Trump joked with then-White House press secretary Sarah Sanders that she would have to “go to North Korea and take one for the team” after the...
94,5,National Defense- Right,"If Kavanaugh And Barrett Betray Pro-Lifers, We Must Blow Up The Conservative Legal Movement",The Federalist, Right,"If we don't have justices who are comfortable overturning outrageously unconstitutional abortion rulings, it will be proof of the conservative legal movement's..."
94,5,National Defense- Right,Supreme Court Will Consider First Of Two Abortion Laws Monday,The Daily Wire, Right,The Supreme Court on Monday will hear arguments in two cases challenging the Texas abortion law that bans most abortions after around six weeks of pregnancy...
94,5,National Defense- Right,Supreme Court To Hear Major Second Amendment Case,One America News Network (OAN), Right,"The U.S. Supreme Court is due to hand down a major ruling on American’s Second Amendment rights. The court recently announced it will hear a case soon, which..."
94,5,National Defense- Right,Supreme Court to hear Texas abortion law arguments on procedural elements of challenges,Fox News (Online News), Right,"The Supreme Court has agreed to expedite and hear procedural elements of two challenges to Texas' new anti-abortion law, which effectively bans most..."
94,5,National Defense- Right,Supreme Court protects cops from lawsuits in two qualified immunity cases,Fox News (Online News), Right,The Supreme Court Monday issued two unsigned opinions applying qualified immunity to disputes over alleged excessive use of force by police...
95,5,National Security- Right,"Trial Explodes: Kyle Rittenhouse Cries on Stand, Judge Berates Prosecutor",National Review, Right,"Kyle Rittenhouse broke down sobbing on the stand while testifying in his own defense on Wednesday, prompting the judge to call a ten-minute recess...."
95,5,National Security- Right,Armed St. Louis Couple Who Confronted BLM Mob Face Possible Law License Suspension,National Review, Right,"A Missouri official has asked the state Supreme Court to suspend the law licenses of Mark McCloskey and Patricia McCloskey, the armed St. Louis..."
95,5,National Security- Right,George Floyd's Brother Uttered the Three Words that Boils the Blood of the Progressive Left,Townhall, Right,"They’re not controversial. It’s common sense. It’s something that everyone can agree with, but it blunts the messaging the progressive Left wants to echo about..."
95,5,National Security- Right,"Mark And Patricia McCloskey Plead Guilty To Misdemeanors, Agree To Give Up Guns",The Daily Wire, Right,"Mark and Patricia McCloskey, the St. Louis, Missouri, couple that went viral after confronting Black Lives Matter protesters on their own front lawn, pleaded..."
95,5,National Security- Right,Minneapolis' George Floyd Square: Crews dismantle barriers as city moves to reopen intersection,Fox News (Online News), Right,Minneapolis city workers could be seen at the intersection at George Floyd Square early Thursday morning – the site of a memorial where former...
96,4,North Korea- Lean Right,"Recordings Reveal Lockstep COVID-19 Protocols, Patient Isolation by Hospitals",The Epoch Times, Lean Right,"Attorneys, medical doctors, and family members of COVID-19 victims have described and offered recordings of what the Truth for Health Foundation..."
96,4,North Korea- Lean Right,Federal Reserve to Hold Conferences on Diversity and Inclusion Next Month,Newsmax (News), Lean Right,"The Federal Reserve announced Monday that it is conducting two virtual diversity and inclusiveness training sessions for its 23,000 employees early..."
96,4,North Korea- Lean Right,Inflating Grades For Social Justice,The American Conservative, Lean Right,"At a party over the weekend I was introduced to a college professor, and fell into conversation with him about teaching and Covid. Then I asked about how..."
96,5,North Korea- Right,Biden’s Chief Of Staff Agrees: Inflation A ‘High-Class Problem’,The Daily Wire, Right,"On Wednesday night, President Biden’s White House Chief of Staff, Ron Klain, apparently sympathetic with the infamous quote attributed to 18th century French..."
96,5,North Korea- Right,Racism Is An Empty Thesis,City Journal, Right,"Turmoil in the United States over police violence is the result of a distorted representation of the problem, says Brown University economist Glenn C. Loury...."
97,5,NSA- Right,GOP Reps Call on Top Biden Admin Officials To Testify on Bungled Afghanistan Withdrawal,Washington Free Beacon, Right,A coalition of Republican foreign policy leaders in Congress is demanding that senior Biden administration officials appear on Capitol Hill to be questioned...
97,5,NSA- Right,Another Democrat Joins the Republican Party,Townhall, Right,"Texas House Democrat Ryan Guillen announced Monday morning he is turning in his Democrat Party membership and joining the GOP. 

""Friends, something is..."
97,4,NSA- Lean Right,Adam Schiff refuses to concede regrets when confronted over Steele dossier,Washington Examiner, Lean Right,Rep. Adam Schiff refused to admit any remorse when grilled again about his promotion of British ex-spy Christopher Steele's now-discredited dossier...
97,5,NSA- Right,Appeals Court Blocks January 6 Committee Access To Trump White House Documents,The Daily Caller, Right,The D.C. Circuit Court of Appeals granted a request from former President Donald Trump to block the January 6 Committee’s access to his White House’s records...
97,5,NSA- Right,"Steele dossier key player gave thousands to Hillary, Dems",Fox News (Online News), Right,"A key player in the debunked Steele dossier gave thousands of dollars to former Secretary of State Hillary Clinton and other Democrats,..."
98,4,Nuclear Weapons- Lean Right,The House Just Voted To Let Marijuana Businesses Legally Use Banks,Reason, Lean Right,"On Wednesday, the U.S. House of Representatives voted in favor of letting state-legal marijuana businesses have access to banks and other financial..."
98,4,Nuclear Weapons- Lean Right,Houston's Police Chief Insists That Cops Who Executed a Deadly Drug Raid Based on Lies 'Had Probable Cause to Be There',Reason, Lean Right,"Although the warrant was based on a heroin purchase that never happened, Art Acevedo says, there was other, unmentioned evidence that would have justified a..."
98,4,Nuclear Weapons- Lean Right,A $25B US counter-drug smuggling operation quietly thrives far south of the border,Washington Examiner, Lean Right,"CORPUS CHRISTI, Texas — Smugglers flying small cocaine-packed airplanes toward the United States from South and Central America might make it to Mexico..."
98,4,Nuclear Weapons- Lean Right,Aaron Sandusky Has Spent 7 Years in Prison for Selling Medical Marijuana,Reason, Lean Right,"Aaron Sandusky has spent nearly seven years in federal prison for conspiracy to distribute cannabis. He's one of about 20,000 federal or state inmates behind..."
98,5,Nuclear Weapons- Right,EXCLUSIVE: Vicente Fox Blames U.S. for Drug War; Violence ‘Is Produced Here’,Breitbart News, Right,"Former Mexican president Vicente Fox suggested Wednesday that drug trafficking and violence at the border aren’t caused by Mexico, but by drug consumption in..."
99,5,Opioid Crisis- Right,"Biden: 'Unless We Generate Consensus in America, We're in Trouble'",CNSNews.com, Right,"In a video conference with grassroots activists, hosted by the Democrat National Committee on Tuesday, President Joe Biden discussed the many ways his big..."
99,4,Opioid Crisis- Lean Right,"Dems, independents join GOP to oppose taxes in Biden $3.5 trillion plan",Washington Examiner, Lean Right,"President Joe Biden’s fading hope to quickly pass a $3.5 trillion tax and spending plan, instantly opposed by Republicans, is also losing steam with his base..."
99,5,Opioid Crisis- Right,"Biden, McConnell Get Booster Shots Following New CDC Guidance",The Daily Wire, Right,"President Joe Biden, 78, received a booster shot against COVID-19 at the White House on Monday afternoon, days after the Centers for Disease Control (CDC)..."
99,5,Opioid Crisis- Right,Biden Vows Executive Action After Republicans Kill Dem Police Reform Bill,The Daily Caller, Right,"President Joe Biden vowed to take executive action to enact police reform “in the coming weeks,” after Republicans on Capitol Hill killed a Democratic police..."
99,4,Opioid Crisis- Lean Right,"George W. Bush, Kamala Harris point to unity after 9/11 in memorial speeches",New York Post (News), Lean Right,"The chimes of the Bells of Remembrance at the memorial service for the victims and heroes of Flight 93 in Shanksville, PA, was followed Saturday by a..."
100,4,Palestine- Lean Right,Retail sales accelerate as supply chain crisis causes earlier start to holiday shopping season,Fox Business, Lean Right,Consumer spending accelerated in October as shoppers kicked off the holiday shopping season earlier than usual due to the supply chain bottlenecks. ...
100,4,Palestine- Lean Right,Thank the Government for the High Price of Holiday Meals,Reason, Lean Right,"As we head into the holidays, part of the season's cheer will be tarnished by the higher prices we'll all pay for holiday festivities. In fact, food, like many..."
100,4,Palestine- Lean Right,How Biden's infrastructure victory lap could disappoint Democrats,Washington Examiner, Lean Right,"President Joe Biden launched a publicity tour touting his newly passed $1.2 trillion bipartisan infrastructure bill, but political operatives in both..."
100,5,Palestine- Right,Psaki Says Inflation Is Being Used As A ‘Political Cudgel’,The Daily Wire, Right,"White House Press Secretary Jen Psaki said that inflation is being utilized as a “political cudgel” and predicted that it will decrease next year.

During a..."
100,4,Palestine- Lean Right,A record 4.4M Americans quit jobs as 'Great Resignation' gathers momentum,Fox Business, Lean Right,"The number of U.S. workers quitting their jobs surged to a record in September as openings remained near an all-time high. 

The..."
101,5,People and Profit- Right,"The Border Crisis Is Killing Americans, Data Shows",The Daily Caller, Right,"Enforcement Agency has called fentanyl the “primary driver” of the record 92,183 drug overdose deaths in 2020. Many drug dealers use..."
101,4,People and Profit- Lean Right,Drug Overdoses: The Epidemic Inflamed by the Pandemic,The Epoch Times, Lean Right,"Jerry Barton lost everyone around him to opioids. First, he lost his sister. Then, his girlfriend. Later, he lost a close friend from suicide stemming from..."
101,5,People and Profit- Right,Abbott: Texas seized enough fentanyl at border to kill 'every single person' in New York,Fox News (Online News), Right,Texas Governor Greg Abbott said Friday that authorities at the border in Texas have apprehended enough fentanyl to kill every single person in the state of New...
101,4,People and Profit- Lean Right,Biden Restores a Barrier to Opioid Addiction Treatment,Reason, Lean Right,Anonymous sources close to the White House say the Biden administration plans to reinstate special licensing requirements for physicians to prescribe...
101,4,People and Profit- Lean Right,"Lockdown Measures Catastrophic for Recovering Addicts, Mental Health",The Epoch Times, Lean Right,Overseeing sober living homes for newly recovering drug addicts is difficult in the best of times. But the endless shutdowns have created conditions that are...
102,5,Polarization- Right,"Prince Philip, Duke of Edinburgh and Queen Elizabeth II's husband, dead at 99",Fox News (Online News), Right,"Prince Philip, Duke of Edinburgh and Queen Elizabeth II’s husband of 73 years, died on Friday at Windsor Castle. He was 99.

The royal family confirmed the..."
102,5,Polarization- Right,Did The Royal Family Really Support The Nazis? Fact-Checking ‘The Crown’,The Daily Wire, Right,"The Crown is one of the most popular shows on the streaming platform, Netflix. The widely acclaimed historical drama, created by Peter Morgan, has won 39..."
102,4,Polarization- Lean Right,Prosperity After Brexit,Wall Street Journal (Opinion), Lean Right,"Brexit came down to the wire but it arrived Thursday, with a new trade deal between the United Kingdom and European Union. Arguments about whether this is a..."
102,4,Polarization- Lean Right,UK issues allergy warning about Pfizer COVID-19 vaccine after patients fall ill,New York Post (News), Lean Right,People with “significant” allergic reactions are being warned not to get Pfizer’s new coronavirus vaccine — after two people needed treatment after being...
102,5,Polarization- Right,UK-U.S. Trade Talks Postponed Because of Coronavirus: Report,Breitbart News, Right,"Negotiations for a free trade agreement between the United Kingdom and the United States have been postponed because of the coronavirus pandemic, according to..."
103,4,Politics- Lean Right,"Biden's spending plan could cost nearly $5T if made permanent, analysis shows",Fox Business, Lean Right,President Biden has unveiled a framework for a modified social spending plan that imagines spending close to $1.75 trillion over the next...
103,5,Politics- Right,"Manchin Is Still No on Reconciliation: ‘What I See Are Shell Games, Budget Gimmicks’",CNSNews.com, Right,"It's time to pass the bipartisan infrastructure bill and ""quit playing games,"" Sen. Joe Manchin (D-W.Va.) told a news conference on Monday.

The senator --..."
103,4,Politics- Lean Right,"Biden to sell spending plans to House Dems, deliver speech to Americans",Washington Times, Lean Right,President Biden will plead with House Democrats to pass his economic agenda and make one last sales pitch to the public Thursday before...
103,4,Politics- Lean Right,Joe Manchin demands climate provisions stripped from budget bill,New York Post (News), Lean Right,West Virginia Sen. Joe Manchin offered a lump of coal to his fellow Democrats after he demanded $150 billion in clean-energy initiatives be removed from a...
103,5,Politics- Right,LOPSIDED: Dems Swamp Republicans (115 to 16) on Evening News Budget Stories,NewsBusters, Right,Is there any surprise our national debt keeps climbing when the voices calling for fiscal responsibility are almost completely drowned out by the national...
104,4,Privacy- Lean Right,Going To Gender Jail,The American Conservative, Lean Right,"Over the years, you’ve probably heard transgender activists and their allies argue in some form that their bodies are a prison preventing them from becoming..."
104,4,Privacy- Lean Right,Associated Press lied about pro-Dave Chappelle comedian at Netflix protest,Washington Examiner, Lean Right,The Associated Press published a story this week about a small protest outside Netflix’s headquarters that was held in response to the company’s...
104,4,Privacy- Lean Right,Associated Press lied about pro-Dave Chappelle comedian at Netflix protest,Washington Examiner, Lean Right,The Associated Press published a story this week about a small protest outside Netflix’s headquarters that was held in response to the company’s...
104,4,Privacy- Lean Right,YouTube suspends Steven Crowder for transgender 'hate speech',Washington Examiner, Lean Right,"Steven Crowder, a conservative YouTuber and political commentator, had his YouTube channel suspended for one week Wednesday for allegedly violating the..."
104,5,Privacy- Right,Netflix Responds To Far-Left Outrage Over Dave Chappelle: We Support His ‘Artistic Freedom’,The Daily Wire, Right,"Netflix co-CEO Ted Sarandos addressed outrage from some inside the company over a new comedy special featuring legendary comedian Dave Chappelle, saying that..."
105,5,Public Health- Right,Judge Rejects Defense Request to Remove Jesse Jackson from Ahmaud Arbery Trial,National Review, Right,The judge presiding over the Ahmaud Arbery trial rejected the defense team’s request to remove civil rights activist Jesse Jackson from the court...
105,5,Public Health- Right,The Book Version Of The New York Times’s 1619 Project Doubles Down On Junk History,The Federalist, Right,"The New York Times has produced a forthcoming book version of its error-riddled 1619 Project, whose outrageous central claim is that slavery and racism are the..."
105,5,Public Health- Right,Biden calls Satchel Paige 'the great negro' in latest gaffe,Fox News (Online News), Right,"President Biden referred to the late baseball player Satchel Paige as ""the great negro"" before correcting himself during his Veterans Day address at..."
105,4,Public Health- Lean Right,McDonald’s CEO apologizes for texts to Chicago mayor that sparked protest,New York Post (News), Lean Right,McDonald’s head honcho Chris Kempczinski has issued an apology for his texts to the mayor of Chicago that sparked protests by critics who accused the...
105,4,Public Health- Lean Right,White House says 'Republicans are lying' about critical race theory in schools,Washington Examiner, Lean Right,White House principal deputy press secretary Karine Jean-Pierre told reporters on Thursday that the issue of race and education in the Virginia gubernatorial...
106,5,Race and Racism- Right,"‘100 Percent False’: Dave Portnoy Denies Sexual Misconduct Allegations, Admits He’s ‘Scared’ Of Cancel Culture",The Daily Caller, Right,"Barstool Sports president Dave Portnoy responded on Thursday to an Insider report about allegations of sexual misconduct made against him.

The Insider ..."
106,4,Race and Racism- Lean Right,Andrew Cuomo charged over alleged groping of former aide: source,New York Post (News), Lean Right,Disgraced ex-Gov. Andrew Cuomo was charged Thursday with groping a former aide in Albany’s Executive Mansion — a crime that could force him to register as...
106,5,Race and Racism- Right,Dozens of Loudoun County students stage walkout over sexual assault by boy in girls' bathroom,Fox News (Online News), Right,"Students in Loudoun County, Virginia, staged a walkout in protest of recent sexual assault cases at the public school system and to show..."
106,5,Race and Racism- Right,Loudoun County Dad Smeared As ‘Domestic Terrorist’ Says School Covered Up Daughter’s Rape By Boy In Girls’ Bathroom,The Federalist, Right,A Loudoun County father smeared as a domestic terrorist by a leftist school board association says his school district covered up his daughter’s rape by a “...
106,4,Race and Racism- Lean Right,'End this nightmare!': Loudoun County parents demand resignation of superintendent over sexual assault claims,Washington Examiner, Lean Right,"Dozens of parents, students, and others are demanding the resignation of a Loudoun County superintendent following outrage over claims of sexual assault...."
107,5,Religion and Faith- Right,GOP Reps Call on Top Biden Admin Officials To Testify on Bungled Afghanistan Withdrawal,Washington Free Beacon, Right,A coalition of Republican foreign policy leaders in Congress is demanding that senior Biden administration officials appear on Capitol Hill to be questioned...
107,5,Religion and Faith- Right,GOP Lawmakers Concerned Biden Removed Sanctions To Appease Iran,Washington Free Beacon, Right,A group of 33 Republican lawmakers launched an investigation on Thursday into the Biden administration’s decision to remove sanctions earlier this month...
107,5,Religion and Faith- Right,Bomb attack on Kabul mosque 'kills 10 and injures more than 30': Memorial service for mother of Taliban's chief spokesman 'is targeted by ISIS militants' in Afghanistan capital,Daily Mail, Right,"A bomb which targeted the entrance of a mosque in the Afghan capital of Kabul on Sunday has left a 'number of civilians dead', according to a Taliban..."
107,4,Religion and Faith- Lean Right,The Generals Contradict Biden on Afghanistan,Wall Street Journal (Opinion), Lean Right,"President Biden hopes the political fallout from his botched Afghanistan withdrawal will fade quickly, but Tuesday’s Senate hearing with the secretary of..."
107,4,Religion and Faith- Lean Right,Gen. Milley defends calls to Chinese: ‘I was certain’ Trump wouldn’t order attack,Washington Times, Lean Right,"America’s top general on Tuesday vehemently defended his Jan. 8 phone call with Chinese military leaders, telling lawmakers that he was “certain” then-..."
108,4,Republican Party- Lean Right,Sen. Cotton: My Bill Will Crack Down on Big Tech,Newsmax (News), Lean Right,"Sen. Tom Cotton says it's time to revive competition and sharply limit further consolidations by Big Tech.

The Arkansas Republican made his..."
108,5,Republican Party- Right,GOP Senators Call Out Biden Nominee’s Rant About Bankrupting Fossil Fuel Industries,The Daily Caller, Right,Republican senators representing some of the U.S.’s leading carbon energy-producing states are speaking out against Comptroller of the Currency nominee Saule...
108,4,Republican Party- Lean Right,Senate GOP blocks federal election law debate for fourth time this year,New York Post (News), Lean Right,"Senate Democrats tried and failed once again Wednesday to begin debate on a bill that would radically revamp America’s election laws, as all but two..."
108,5,Republican Party- Right,"Manchin Is Still No on Reconciliation: ‘What I See Are Shell Games, Budget Gimmicks’",CNSNews.com, Right,"It's time to pass the bipartisan infrastructure bill and ""quit playing games,"" Sen. Joe Manchin (D-W.Va.) told a news conference on Monday.

The senator --..."
108,4,Republican Party- Lean Right,"Senate Republicans block Freedom to Vote Act, Democrats’ latest election overhaul bill",Washington Examiner, Lean Right,"Senate Republicans on Wednesday blocked the advancement of the Freedom to Vote Act, one of three major voting bills brought forward by Democrats in Congress..."
109,4,Role of Government- Lean Right,"Biden's spending plan could cost nearly $5T if made permanent, analysis shows",Fox Business, Lean Right,President Biden has unveiled a framework for a modified social spending plan that imagines spending close to $1.75 trillion over the next...
109,4,Role of Government- Lean Right,"Biden plan to hire 80K IRS agents will backfire, letting wealthy dodge taxes, expert warns",Washington Times, Lean Right,"President Biden’s proposed tax hikes and plan to hire more than 80,000 additional Internal Revenue Service agents could wind up helping the super-..."
109,5,Role of Government- Right,IRS Adjusts Tax Brackets As Inflation Hits 30-Year High,The Daily Wire, Right,The Internal Revenue Service revealed that it would adjust federal income tax brackets and deductions in light of rising price levels in the United States....
109,5,Role of Government- Right,Democrat Cindy Axne Falsely Claims Biden’s $1.75T Agenda Will Cost Iowans ‘Literally Nothing’,Breitbart Fact Check, Right,"CLAIM: Democrat Rep. Cindy Axne (D-IA) claimed last week that President Joe Biden’s Build Back Better agenda will cost Iowans “literally nothing.”

VERDICT:..."
109,5,Role of Government- Right,Democrats release text of massive social spending bill,Fox News (Online News), Right,"Democrats have released the text of their massive social spending bill, outlining many of the priorities of President Biden's ""Build Back Better"" plan.

The..."
110,5,Russia- Right,"Steele dossier key player gave thousands to Hillary, Dems",Fox News (Online News), Right,"A key player in the debunked Steele dossier gave thousands of dollars to former Secretary of State Hillary Clinton and other Democrats,..."
110,5,Russia- Right,"Walker off to fast start, hauling in $3.7M since launching Senate bid",Fox News (Online News), Right,Republican Senate candidate Herschel Walker has sprinted out of the blocks when it comes to fundraising for his Senate campaign to try and...
110,4,Russia- Lean Right,Koch-aligned leaders oppose banning critical race theory,Washington Examiner, Lean Right,"Leaders affiliated with Koch Industries, famous for backing conservative political candidates, decided not to support a government ban on critical race theory..."
110,4,Russia- Lean Right,Biden turns on the Democratic Party fundraising machine for 2022,Washington Examiner, Lean Right,President Joe Biden's dive into the pool of high-dollar fundraisers this summer comes with an appeal to party unity and the promise of nailing big-ticket...
110,4,Russia- Lean Right,Arizona judge presses for disclosure of donors funding Maricopa election audit,Washington Examiner, Lean Right,An Arizona judge on Wednesday questioned the claim that the public does not have the right to know who is funding the audit of the Maricopa County...
111,4,Science- Lean Right,White House to go on offense against GOP on debt ceiling and Trump-era deficits,Washington Examiner, Lean Right,The White House is ending its hands-off approach to the ongoing debt ceiling standoff between Democratic and Republican leadership on Capitol Hill and is...
111,5,Science- Right,Yellen: US Will Be Out Of Money In October If Congress Doesn’t Raise Debt Ceiling,The Daily Caller, Right,Treasury Secretary Janet Yellen warned congressional leaders Wednesday that the U.S. is on track to default on its debt sometime in October if Congress fails...
